premium,is_available,category,title,rent_price_per_day,image_url,created_at,price,user_id,location,description,condition,quantity,updated_at,for_sale
TRUE,TRUE,Screens,Ambient Star Light LED Projector,0,https://pictures-kenya.jijistatic.com/54795717_MzAwLTIyNS0zOGU3MjJmMTll.webp,03/05/2025 22:49,1480,10,"Nairobi, Unknown","Multifunctional:Great style atmosphere and highlight focus starry lamp for decorating cars,...",Brand New,1,03/05/2025 22:49,1
TRUE,TRUE,Screens,CCTV Camera Looking 180W Solar Motion Sensor Floodlight,0,https://pictures-kenya.jijistatic.com/55622210_MzAwLTI0MC1mOTdhYzJjYTIz.webp,03/05/2025 22:49,800,10,"Nairobi, Unknown",- 2 in 1 Solar Light & Security Dummy Camera - Keep your home property safe and intruders away. With...,Brand New,1,03/05/2025 22:49,1
TRUE,TRUE,Screens,Fog Machine  2500 Watslts With LED Lights,0,https://pictures-kenya.jijistatic.com/73595255_MzAwLTE2OS1jMDk2YzQ2MDYw.webp,03/05/2025 22:49,31000,13,"Nairobi, Unknown",Fog Machine  2500 Watslts With LED Lights now available,Used,3,03/05/2025 22:49,1
TRUE,FALSE,Screens,Qquality LED Stage Light Tf8kj,183,https://pictures-kenya.jijistatic.com/72155859_MzAwLTMwMC0zZTI2OTZkYzUz.webp,03/05/2025 22:49,5500,16,"Nairobi, Unknown","【60 LED RGB Par lights】The 60 lamp beads emit light together, with high brightness and beautiful...",Used,1,03/05/2025 22:49,0
TRUE,FALSE,Screens,"Events Stage Lights, 36 Leds, 36 Watts.",85,https://pictures-kenya.jijistatic.com/63646775_MzAwLTQwMC1lYWYxMDcwZDY1.webp,03/05/2025 22:49,2570,22,"Nairobi, Unknown","Led stage lights , 36 watts stage lights, Dmx controlled and remote controlled",Used,3,03/05/2025 22:49,0
TRUE,TRUE,Screens,300watts JSOT SOLAR LIGHT Security Solar Floodlight,0,https://pictures-kenya.jijistatic.com/68656905_MzAwLTQwMC1kNTMxYjNmNDY2.webp,03/05/2025 22:49,6200,12,"Nairobi, Unknown","300watts solar floodlight.
Super bright Led light.
Suitable for outdoor security lighting.
Automatic...",Brand New,2,03/05/2025 22:49,1
TRUE,TRUE,Screens,NEW Multicolor Stage Lights,0,https://pictures-kenya.jijistatic.com/60467577_MzAwLTIyNS0zZTEyN2E0N2Zl.webp,03/05/2025 22:49,2510,2,"Nairobi, Unknown",Original model: ZQ-B262-YK New model: ZQ00130002 Power Consumption:72w Voltage: 110V-220V...,Used,1,03/05/2025 22:49,1
TRUE,FALSE,Screens,100watts Bright Dusk to Dawn Complete SOLAR FLOODLIGHT,0,https://pictures-kenya.jijistatic.com/70501994_MzAwLTMzMS0zNTNiOTEzMjU5.webp,03/05/2025 22:49,3800,10,"Nairobi, Unknown","Automatic light on at dark and off at day.
Super bright Led light.
Comes with an all weather solar...",Brand New,1,03/05/2025 22:49,1
TRUE,FALSE,Screens,180watts Fake Dummy Camera Solar Powered Floodlight,25,https://pictures-kenya.jijistatic.com/65021736_MzAwLTMwMC05NzdiZjdiYTU5.webp,03/05/2025 22:49,760,6,"Nairobi, Unknown",Outdoor Solar light with motion sensor modes. Looks like a realistic monitoring camera. Its a dummy...,Used,2,03/05/2025 22:49,0
TRUE,FALSE,Screens,Mini 200watts Solar Floodlight Super Bright Outdoor Light,0,https://pictures-kenya.jijistatic.com/67576887_MzAwLTQwMC1jOWE0YmExN2Ux.webp,03/05/2025 22:49,3200,6,"Nairobi, Unknown","New cclamp Solar mini floodlights.
They come complete with a solar panel, remote control and...",Brand New,2,03/05/2025 22:49,1
FALSE,FALSE,Screens,"Disco Light,Led Mini Par Light for Events",0,https://pictures-kenya.jijistatic.com/66319821_MzAwLTQwMC1kNDMxYjUwMjY2.webp,03/05/2025 22:49,2499,16,"Nairobi, Unknown",Good quality gobo stage lead lights,Used,2,03/05/2025 22:49,1
TRUE,FALSE,Screens,Beam 230 LED Lights,2000,https://pictures-kenya.jijistatic.com/51564946_MzAwLTQwMC0xZDczYTcyMDMw.webp,03/05/2025 22:49,60000,1,"Nairobi, Unknown",Beam 230 Stage Lights,Used,2,03/05/2025 22:49,0
TRUE,FALSE,Screens,Disco Stage Light Multi-Coloured,833,https://pictures-kenya.jijistatic.com/41569851_MzAwLTI1MC00NzM0Y2M5NjFiLTE.webp,03/05/2025 22:49,25000,5,"Nairobi, Unknown","Apart from using these lights as party lights, they can also be used as Diwali decoration LED...",Brand New,4,03/05/2025 22:49,0
TRUE,TRUE,Screens,Three Color Changing 100watts Solar Ceiling Lights,0,https://pictures-kenya.jijistatic.com/68838955_MzAwLTIyNS04ZDhiZDkxN2Ux.webp,03/05/2025 22:49,2500,20,"Nairobi, Unknown","100w Solar powered ceiling lights.
Indoor and outdoor lighting.
Comes complete with a solar panel,...",Brand New,3,03/05/2025 22:49,1
TRUE,FALSE,Screens,Solar Interaction Motion Sensor Unique Wall Light,0,https://pictures-kenya.jijistatic.com/56320073_MzAwLTQwMC01YTBlMWQwYWJm.webp,03/05/2025 22:49,950,4,"Nairobi, Unknown",Solar Wall Light Zero Electricity Bill: This LED solar wall light operates without batteries or...,Brand New,1,03/05/2025 22:49,1
TRUE,TRUE,Screens,Disco Stage Light Multi-Coloured With 36 Bulbs,0,https://pictures-kenya.jijistatic.com/60458514_MzAwLTQwMC0zNzNlYTBhNDRk.webp,03/05/2025 22:49,2580,19,"Nairobi, Unknown","Party lights, they can also be used as Diwali decoration LED lights. There are many different types...",Used,1,03/05/2025 22:49,1
TRUE,TRUE,Screens,Modern Entertainment Stand With Fireplace Lights Storage,0,https://pictures-kenya.jijistatic.com/73465929_MzAwLTEzMi0zMTVkNmNmODY3.webp,03/05/2025 22:49,24000,2,"Nairobi, Unknown","For sale: A sleek and modern 5-foot TV stand with a built-in electric fireplace, perfect for adding...",Brand New,5,03/05/2025 22:49,1
TRUE,FALSE,Screens,Wooden Executive Tv Stand Zh-02-2,0,https://pictures-kenya.jijistatic.com/74610114_MzAwLTQwMC1lOGFmZTJkOTUw.webp,03/05/2025 22:49,2700,19,"Nairobi, Unknown","Premium Materials: Made from high-quality wood, MDF, tempered glass, or a combination of materials...",Brand New,4,03/05/2025 22:49,1
TRUE,TRUE,Screens,Glass Cabinet+ Tv Stand All With Led Lights,866,https://pictures-kenya.jijistatic.com/52538915_MzAwLTIyNS1mMDc2ODI4Zjc2.webp,03/05/2025 22:49,26000,10,"Nairobi, Unknown","Modern glass cabinet+ Tv stand, all with led lights, cabinet with, glass shelves, bottom storage...",Brand New,3,03/05/2025 22:49,0
TRUE,TRUE,Screens,Tv Stand Tv Stand,0,https://pictures-kenya.jijistatic.com/63409944_MzAwLTQwMC02MWQyMzQyYmNi.webp,03/05/2025 22:49,8500,2,"Nairobi, Unknown","Led lighting, 
Strong, 
Pay on delivery",Brand New,3,03/05/2025 22:49,1
TRUE,TRUE,Screens,Led Lights Tv Stand With Electric Fireplace 2 Storage Doors,0,https://pictures-kenya.jijistatic.com/73465960_MzAwLTEzMi1mOGE0Y2QyNWZj.webp,03/05/2025 22:49,24000,9,"Nairobi, Unknown","For sale: A sleek and modern 5-foot TV stand with a built-in electric fireplace, perfect for adding...",Brand New,1,03/05/2025 22:49,1
TRUE,TRUE,Screens,Sleek Tv Stand White Plain With Led Lights,383,https://pictures-kenya.jijistatic.com/74893262_MzAwLTIyNS1iMDJiODkzY2Jj.webp,03/05/2025 22:49,11500,22,"Nairobi, Unknown",Elevate your living space with this sleek 5-foot white TV stand featuring built-in LED lighting. It...,Brand New,5,03/05/2025 22:49,0
TRUE,TRUE,Screens,Wooden Bedside Drawer,0,https://pictures-kenya.jijistatic.com/56588450_MzAwLTMwMC1jOGY2YWU1ZTU3.webp,03/05/2025 22:49,9800,23,"Nairobi, Unknown","New Stock:
Wooden Bedside Drawer /
 LED Lighting Glass Top
Dimension: (L50cm W40cm H45cm)",Brand New,1,03/05/2025 22:49,1
TRUE,FALSE,Screens,Tv Stand for Sale 5 Feet Long White Plain,383,https://pictures-kenya.jijistatic.com/74893400_MzAwLTIyNS03MjU4NDA2MmNi.webp,03/05/2025 22:49,11500,10,"Nairobi, Unknown",Elevate your living space with this sleek 5-foot white TV stand featuring built-in LED lighting. It...,Brand New,1,03/05/2025 22:49,0
TRUE,TRUE,Screens,Monochrome Coffee Table 2 Stools Glasstop Black+ Tv Stand,990,https://pictures-kenya.jijistatic.com/73466945_MzAwLTIyMS0wOGM5NWJiNTIz.webp,03/05/2025 22:49,29700,3,"Nairobi, Unknown","Upgrade your living room with this stylish furniture set, featuring a black and white glass-top...",Brand New,1,03/05/2025 22:49,0
TRUE,TRUE,Screens,"Istanbul 1 TV Stand: LED, Black White",233,https://pictures-kenya.jijistatic.com/73600296_MzAwLTI2MC1kM2Q5M2Y1ZDE2LTI.webp,03/05/2025 22:49,7000,17,"Nairobi, Unknown",The Istanbul 1 Modern TV Stand is a contemporary entertainment center designed to elevate your...,Brand New,4,03/05/2025 22:49,0
TRUE,TRUE,Screens,Wooden Executive Tv Stand,91,https://pictures-kenya.jijistatic.com/74610169_MzAwLTMxNS00NjY1YmVmNjdh.webp,03/05/2025 22:49,2750,8,"Nairobi, Unknown","Premium Materials: Made from high-quality wood, MDF, tempered glass, or a combination of materials...",Brand New,5,03/05/2025 22:49,0
TRUE,TRUE,Screens,Fireplace Media Stand 5 Feet,0,https://pictures-kenya.jijistatic.com/73466118_MzAwLTEzMy1jYjVmNTFlMjBl.webp,03/05/2025 22:49,24000,3,"Nairobi, Unknown","For sale: A sleek and modern 5-foot TV stand with a built-in electric fireplace, perfect for adding...",Brand New,5,03/05/2025 22:49,1
TRUE,TRUE,Screens,Executive Tv Stand Rb-58000b,110,https://pictures-kenya.jijistatic.com/74609807_MzAwLTI2NS0zODlmZTI1Mjcy.webp,03/05/2025 22:49,3300,19,"Nairobi, Unknown","Premium Materials: Made from high-quality wood, MDF, tempered glass, or a combination of materials...",Brand New,3,03/05/2025 22:49,0
FALSE,FALSE,Screens,Fashionable TV Stand With Filled LED Lighting,0,https://pictures-kenya.jijistatic.com/50356272_MzAwLTMwMC0zN2QxMTRiNDI5LTI.webp,03/05/2025 22:49,11280,8,"Nairobi, Unknown","Classy
fashionable
with filled led lighting
can support upto 50 inch size tv",Brand New,1,03/05/2025 22:49,1
TRUE,TRUE,Screens,Tv Stand With Led Lights Marble Top With Gold Belt,400,https://pictures-kenya.jijistatic.com/74300591_MzAwLTEzMi1iZjczZTY2OGFi.webp,03/05/2025 22:49,12000,6,"Nairobi, Unknown","TV Stand with LED Lights – 5ft
Upgrade your living space with this stylish TV stand featuring a...",Brand New,4,03/05/2025 22:49,0
TRUE,TRUE,Screens,Classic Tv Stand With an Led Light,766,https://pictures-kenya.jijistatic.com/74286634_MzAwLTMwMC05ZGYyZWJiOTgy.webp,03/05/2025 22:49,23000,3,"Nairobi, Unknown",Brand new tv stand with led lighting,Brand New,1,03/05/2025 22:49,0
TRUE,FALSE,Screens,Television Stand With Fireplace 5ft White,0,https://pictures-kenya.jijistatic.com/74464896_MzAwLTIyNS05MGViZDgyYjgw.webp,03/05/2025 22:49,24000,2,"Nairobi, Unknown","5ft TV Stand with Fireplace, LED Lights & Gold Accents
Upgrade your living space with this elegant...",Brand New,3,03/05/2025 22:49,1
FALSE,FALSE,Screens,Modern Tv Unit,2833,https://pictures-kenya.jijistatic.com/74698323_MzAwLTQzNi01YTU4OTg2MTNl.webp,03/05/2025 22:49,85000,12,"Nairobi, Unknown","Function: Provides a platform for the TV and storage for media devices, gaming consoles, and...",Brand New,2,03/05/2025 22:49,0
TRUE,TRUE,Screens,Sleek Led - Lit Tv Stand With Fireplace Dual Storage Doors,0,https://pictures-kenya.jijistatic.com/73465792_MzAwLTEzMy1mMDQwOGE5ZWVk.webp,03/05/2025 22:49,24000,11,"Nairobi, Unknown","For sale: A sleek and modern 5-foot TV stand with a built-in electric fireplace, perfect for adding...",Brand New,3,03/05/2025 22:49,1
TRUE,TRUE,Screens,Tv Stand and Kitchen Cabinet All White With Led Lights,0,https://pictures-kenya.jijistatic.com/74057173_MzAwLTM1Ni03MTJiNjRhNzJi.webp,03/05/2025 22:49,25000,21,"Nairobi, Unknown","Modern Kitchen Cabinet & TV Stand Set – LED Lights & Ample Storage
Upgrade your space with this...",Brand New,3,03/05/2025 22:49,1
TRUE,FALSE,Screens,"Open Shelf for Books:Style, Functionality and Beauty",0,https://pictures-kenya.jijistatic.com/70213755_MzAwLTM3NS0zOTFlYWY4NmMx.webp,03/05/2025 22:49,120000,23,"Nairobi, Unknown","Open shelving adds lightness and Airiness to the Interior
We have added an outdoor shelf for...",Brand New,2,03/05/2025 22:49,1
TRUE,FALSE,Screens,Visionary Dream Kitchen,0,https://pictures-kenya.jijistatic.com/66892290_MzAwLTM3NS0xODcyNGQwNmMx.webp,03/05/2025 22:49,900000,16,"Nairobi, Unknown","go ahead, close your eyes and dive into the vision of your dream kitchen: walnut tones that hug...",Brand New,4,03/05/2025 22:49,1
TRUE,FALSE,Screens,Tv Stand for Sale 5 Feet Long White Plain,383,https://pictures-kenya.jijistatic.com/74893400_MzAwLTIyNS03MjU4NDA2MmNi.webp,03/05/2025 22:49,11500,12,"Nairobi, Unknown",Elevate your living space with this sleek 5-foot white TV stand featuring built-in LED lighting. It...,Brand New,4,03/05/2025 22:49,0
TRUE,FALSE,Screens,Gaming Chair; Futuristic Adjustable Game Seat,0,https://pictures-kenya.jijistatic.com/74727202_MzAwLTMwMC0zNDc3MzNkNDU5.webp,03/05/2025 22:49,28500,18,"Nairobi, Unknown","Take your gaming experience to the next level with the Futuristic Adjustable Game Seat, a sleek,...",Brand New,5,03/05/2025 22:49,1
TRUE,FALSE,Screens,Dressers : Queen's Vanity Dressing Table With Led,0,https://pictures-kenya.jijistatic.com/72354384_MzAwLTMwMC04YmM1YTZjZjM2.webp,03/05/2025 22:49,28500,3,"Nairobi, Unknown","Enhance your beauty routine with the Queen's Vanity Dressing Table with LED lighting, a luxurious...",Brand New,5,03/05/2025 22:49,1
TRUE,TRUE,Screens,Glass Utensils Cupboard With Led Lights.,516,https://pictures-kenya.jijistatic.com/52537745_MzAwLTQwMC00YWJjNWY3ZDIw.webp,03/05/2025 22:49,15500,6,"Nairobi, Unknown","Glass utensils cupboard, with led lights, brand new, Best quality, with glass shelves, with bottom...",Brand New,3,03/05/2025 22:49,0
TRUE,FALSE,Screens,Monochrome Coffee Table 2 Stools Glasstop Black+ Tv Stand,0,https://pictures-kenya.jijistatic.com/73466945_MzAwLTIyMS0wOGM5NWJiNTIz.webp,03/05/2025 22:49,29700,1,"Nairobi, Unknown","Upgrade your living room with this stylish furniture set, featuring a black and white glass-top...",Brand New,3,03/05/2025 22:49,1
TRUE,TRUE,Screens,Glass Utensils Cupboard With Led Lights,516,https://pictures-kenya.jijistatic.com/52538033_MzAwLTQwMC0xYWYyN2E0NzQ2.webp,03/05/2025 22:49,15500,22,"Nairobi, Unknown","Glass utensils cupboard, with led lights, brand new, Best quality, with glass shelves, with bottom...",Brand New,1,03/05/2025 22:49,0
TRUE,TRUE,Screens,Makeup Vanity Set With Mirror and Lights,0,https://pictures-kenya.jijistatic.com/69842656_MzAwLTMwMC1kYjY3NDg5NGVm.webp,03/05/2025 22:49,26500,14,"Nairobi, Unknown","Crafted with precision, our (vanity desk) integrates a reliable structure with eco-friendly Medium...",Brand New,3,03/05/2025 22:49,1
TRUE,FALSE,Screens,Dressing Table; Makeup Dressing Vanity Table,883,https://pictures-kenya.jijistatic.com/70162179_MzAwLTMwMC05ODU1YTY4NmIw.webp,03/05/2025 22:49,26500,6,"Nairobi, Unknown","This elegant makeup dressing vanity table features a sleek, modern design with a polished surface...",Brand New,2,03/05/2025 22:49,0
TRUE,TRUE,Screens,Glass Utensils Cupboard With Led Lights,516,https://pictures-kenya.jijistatic.com/52538086_MzAwLTQwMC1hOWE0MmMwYmE1.webp,03/05/2025 22:49,15500,16,"Nairobi, Unknown","Glass utensils cupboard, with led lights, brand new, Best quality, with glass shelves, with bottom...",Brand New,4,03/05/2025 22:49,0
TRUE,FALSE,Screens,Home Mirror : Generic Full Length Executive Dressing Mirror,216,https://pictures-kenya.jijistatic.com/73882192_MzAwLTQwMC0wMGU2MDIzMTk0.webp,03/05/2025 22:49,6500,8,"Nairobi, Unknown","Transform your space with the Generic Full Length Executive Dressing Mirror, a stylish and...",Brand New,1,03/05/2025 22:49,0
TRUE,TRUE,Screens,Bookcases: Modern Bookshelf Rack,350,https://pictures-kenya.jijistatic.com/72785704_MzAwLTMwMC1mMzMyZWE1OGMw.webp,03/05/2025 22:49,10500,4,"Nairobi, Unknown","A modern bookshelf rack is a contemporary storage piece designed to organize and display books,...",Brand New,5,03/05/2025 22:49,0
TRUE,FALSE,Screens,Dressing Table With LED Lighting,0,https://pictures-kenya.jijistatic.com/62179140_MzAwLTMwMC1jNTM1NjlhNmE3.webp,03/05/2025 22:49,22000,3,"Nairobi, Unknown","New Stock:
Dressing Table with LED Lighting 
Dimensions: H155cm L100cm D40cm
 @ 22,000",Brand New,2,03/05/2025 22:49,1
TRUE,FALSE,Screens,Modern Entertainment Stand With Fireplace Lights Storage,800,https://pictures-kenya.jijistatic.com/73465929_MzAwLTEzMi0zMTVkNmNmODY3.webp,03/05/2025 22:49,24000,11,"Nairobi, Unknown","For sale: A sleek and modern 5-foot TV stand with a built-in electric fireplace, perfect for adding...",Brand New,3,03/05/2025 22:49,0
FALSE,TRUE,Screens,Cabinets: Half Glass Modern Office Cabinets,0,https://pictures-kenya.jijistatic.com/75244798_MzAwLTMwMC1jNDI4YWM0MTA2.webp,03/05/2025 22:49,23500,8,"Nairobi, Unknown","A glass modern cabinet combines sleek design with functionality, making it a stylish addition to...",Brand New,2,03/05/2025 22:49,1
TRUE,FALSE,Screens,Tv Stand With Led Lights Marble Top With Gold Belt,400,https://pictures-kenya.jijistatic.com/74300591_MzAwLTEzMi1iZjczZTY2OGFi.webp,03/05/2025 22:49,12000,13,"Nairobi, Unknown","TV Stand with LED Lights – 5ft
Upgrade your living space with this stylish TV stand featuring a...",Brand New,3,03/05/2025 22:49,0
TRUE,FALSE,Screens,Make Up Station,733,https://pictures-kenya.jijistatic.com/54160203_MzAwLTMwMC1jOGZkYzQ2NWQ2.webp,03/05/2025 22:49,22000,7,"Nairobi, Unknown","Make Up station / Dressing Table 
Has Makeup lighting. 
You can visit our showroom along Mombasa...",Brand New,2,03/05/2025 22:49,0
TRUE,FALSE,Screens,Wooden Executive Tv Stand Zh-02-2,0,https://pictures-kenya.jijistatic.com/74610114_MzAwLTQwMC1lOGFmZTJkOTUw.webp,03/05/2025 22:49,2700,7,"Nairobi, Unknown","Premium Materials: Made from high-quality wood, MDF, tempered glass, or a combination of materials...",Brand New,1,03/05/2025 22:49,1
TRUE,FALSE,Screens,"Wooden Bedside Drawer 
 LED Lighting Glass Top",583,https://pictures-kenya.jijistatic.com/61695169_MzAwLTMwMC1lZjNjOTFjYjlmLTE.webp,03/05/2025 22:49,17500,8,"Nairobi, Unknown","Wooden Bedside Drawer 
 LED Lighting Glass Top
 3 Drawers 
Dimension: (L50cm W40cm H56cm)",Brand New,2,03/05/2025 22:49,0
FALSE,TRUE,Lighting,Yololiv Yolobox Ultra Portable Multicamera Encoder/Streamer,0,https://pictures-kenya.jijistatic.com/65618357_MzAwLTIyNS1iZGUxMWMwNWE2.webp,03/05/2025 22:49,198000,6,"Nairobi, Unknown","Encoder, Monitor, Switcher & Recorder
Capable of live streaming in both horizontal and vertical...",Used,1,03/05/2025 22:49,1
FALSE,TRUE,Lighting,"Yololiv Yolobox Pro Portable Multi-Camera Streamer, Switcher",4166,https://pictures-kenya.jijistatic.com/69261884_MzAwLTQwMC04ODJmNjVlMTYw.webp,03/05/2025 22:49,125000,14,"Nairobi, Unknown","Simultaneous Cross-Platform Streaming
• Encoder, Monitor, Switcher, and Recorder
• 8′′ Touchscreen...",Used,5,03/05/2025 22:49,0
FALSE,TRUE,Lighting,Yololiv Yolobox Mini All-in-One Smart Live Streaming Monitor,3350,https://pictures-kenya.jijistatic.com/37865336_MzAwLTMwMC1mZWE2MmY5NGJj.webp,03/05/2025 22:49,100500,20,"Nairobi, Unknown",YoloBox Mini Ultra-Portable All-in-One Smart Live Streaming Encoder & Monitor from YoloLiv the...,Used,3,03/05/2025 22:49,0
TRUE,TRUE,Lighting,YOLOLIV Yolobox Portable Live Stream,0,https://pictures-kenya.jijistatic.com/53598037_MzAwLTQwMC00YTJjN2NhOWNkLTI.webp,03/05/2025 22:49,125000,16,"Nairobi, Unknown","Simultaneous Cross-Platfrom Streaming
Encoder,Monitor, Switcher and Recorder
5.5"" LCD Touchscreen...",Brand New,4,03/05/2025 22:49,1
TRUE,TRUE,Lighting,Yololiv Yolobox PRO Portable,5833,https://pictures-kenya.jijistatic.com/52546053_MzAwLTI5OC1jZDY5MTI0OGQ3.webp,03/05/2025 22:49,175000,6,"Nairobi, Unknown",Create a live stream production from anywhere with the ultra-portable YoloBox Pro Portable...,Used,5,03/05/2025 22:49,0
FALSE,FALSE,Lighting,Yolobox Switcher,0,https://pictures-kenya.jijistatic.com/70230912_MzAwLTMwMC05Zjc4NDAxNzg5.webp,03/05/2025 22:49,117000,16,"Nairobi, Unknown",YoloLiv YoloBox Portable Multi-Cam Live Streaming Studio Encoder Recorder Switcher,Used,3,03/05/2025 22:49,1
FALSE,FALSE,Lighting,Yolobox Portable Live Stream Studio Equipment Encoder Switch,3633,https://pictures-kenya.jijistatic.com/53837673_MzAwLTIyMi01ZTE5ZmMyZTNh.webp,03/05/2025 22:49,109000,20,"Nairobi, Unknown","Touchscreen Control Streaming Encoder
Simultaneous Cross-Platform Streaming
Encoder, Monitor,...",Used,1,03/05/2025 22:49,0
FALSE,TRUE,Lighting,Yololiv Yolobox Pro Portable Multi-Camera Encoder/Streamer/S,0,https://pictures-kenya.jijistatic.com/44640934_MzAwLTEzNS1kOTcwMTBjMzFm.webp,03/05/2025 22:49,132000,16,"Nairobi, Unknown","Simultaneous Cross-Platform Streaming
Encoder, Monitor, Switcher, and Recorder
8′′ Touchscreen...",Used,2,03/05/2025 22:49,1
TRUE,FALSE,Lighting,Yololiv Yolobox Ultra Live Streaming System,0,https://pictures-kenya.jijistatic.com/64898356_MzAwLTI0MC0xY2VjZDNhNGMx.webp,03/05/2025 22:49,189000,10,"Nairobi, Unknown","Highlights
YoloBox Ultra Live Streaming System
YoloBox Ultra Cage with Shoe Mount
Ball Head, Desktop...",Used,5,03/05/2025 22:49,1
TRUE,TRUE,Lighting,Yololiv Yolobox Mini Smart Live Streaming Encoder Monitor,3266,https://pictures-kenya.jijistatic.com/40274122_MzAwLTEzNS03NjdlNzRmZTBm.webp,03/05/2025 22:49,97999,5,"Nairobi, Unknown","Key features:
Simultaneous Cross-Platform Streaming
Encoder, Monitor, Switcher, and Recorder
5.5′′...",Used,5,03/05/2025 22:49,0
TRUE,TRUE,Lighting,Yololiv Yolobox Portable Live Stream,4166,https://pictures-kenya.jijistatic.com/53598073_MzAwLTE2OC03ZGMwYjM3N2M3LTI.webp,03/05/2025 22:49,125000,16,"Nairobi, Unknown",The industry’s first REALLY All-IN-ONE live production system that doesn’t require anything...,Brand New,2,03/05/2025 22:49,0
FALSE,FALSE,Lighting,Yolobox Instream Vertical Live Streaming Encoder and Monitor,4266,https://pictures-kenya.jijistatic.com/56620828_MzAwLTQwMC0yZGYxMGZkNzU4LTE.webp,03/05/2025 22:49,128000,12,"Nairobi, Unknown","Encoder, Monitor, Recorder, Switcher
Intuitive 7"" Touchscreen LCD Display
Stream via Ethernet,...",Used,4,03/05/2025 22:49,0
FALSE,TRUE,Lighting,Blackmagic Design ATEM Mini Pro HDMI Live Stream Switcher,1999,https://pictures-kenya.jijistatic.com/11358145_img-1597153043591_1_300x240.webp,03/05/2025 22:49,59999,7,"Nairobi, Unknown","Similar to its predecessor, the atem mini, the atem mini pro from blackmagic design is a four-input...",Used,1,03/05/2025 22:49,0
FALSE,FALSE,Lighting,Yolobox Mini,0,https://pictures-kenya.jijistatic.com/74856049_MzAwLTE5My00NWQ4ZWYzZWNh.webp,03/05/2025 22:49,85000,19,"Nairobi, Unknown",Make the YoloBox Mini All-in-One Live Streaming System from YoloLiv the central hub for recording...,Used,1,03/05/2025 22:49,1
FALSE,FALSE,Lighting,Yolobox Pro,0,https://pictures-kenya.jijistatic.com/65566889_MzAwLTIyNS0xNTFkM2VkZDA4.webp,03/05/2025 22:49,124000,21,"Nairobi, Unknown",Create a live stream production from anywhere with the YoloBox Pro All-in-One Multi-Camera Switching...,Used,4,03/05/2025 22:49,1
TRUE,FALSE,Lighting,Yololiv Yolobox PRO Portable Multi-Camera Encoder,0,https://pictures-kenya.jijistatic.com/52545881_MzAwLTMwMC1mMWVjZDJkMGMx.webp,03/05/2025 22:49,170000,2,"Nairobi, Unknown","Simultaneous Cross-Platform Streaming
Encoder, Monitor, Switcher, and Recorder
8′′ Touchscreen...",Brand New,3,03/05/2025 22:49,1
FALSE,TRUE,Lighting,Yolobox Mini Yololiv,0,https://pictures-kenya.jijistatic.com/52851959_MzAwLTIyNS1mMzAwNDk3MDli.webp,03/05/2025 22:49,97999,21,"Nairobi, Unknown","Mini, Mobile, Mighty
YoloBox Mini is a super portable live streaming encoder, monitor and recorder...",Used,4,03/05/2025 22:49,1
FALSE,TRUE,Lighting,Elgato Hd60 X External Capture Card 1080p60 HDR,0,https://pictures-kenya.jijistatic.com/74535383_MzAwLTMxMi05MjMzNzcxOTYz.webp,03/05/2025 22:49,45000,9,"Nairobi, Unknown","Up to 1080p60 hdr gaming capture
 4k60 hdr10 pass-through to your tv
 1440p120 or 1080p240 high...",Brand New,3,03/05/2025 22:49,1
TRUE,FALSE,Lighting,"Yololiv Instream, the Ultimate All-in-One",0,https://pictures-kenya.jijistatic.com/53598045_MzAwLTMwMC1lNDYyNjVjOTIzLTI.webp,03/05/2025 22:49,124500,14,"Nairobi, Unknown",The new Yolobox Mini Ultra-Portable All-in-One Smart Live Streaming Encoder and Monitor can...,Brand New,2,03/05/2025 22:49,1
TRUE,TRUE,Lighting,Yolobox Portable Live Stream Studio,4299,https://pictures-kenya.jijistatic.com/32647646_MzAwLTY2Ni03Mzc4MTgzODY4.webp,03/05/2025 22:49,128999,2,"Nairobi, Unknown","Touchscreen control streaming encoder
simultaneous cross-platform streaming
encoder, monitor,...",Used,2,03/05/2025 22:49,0
FALSE,TRUE,Camera,Multicolored Microphone Holder,0,https://pictures-kenya.jijistatic.com/73307294_MzAwLTUzMy01N2MxZDc4NTBh.webp,03/05/2025 22:49,7500,9,"Nairobi, Unknown","We customize all our podiums as per the needs of our clients in terms of design , color and size",Brand New,2,03/05/2025 22:49,1
TRUE,FALSE,Camera,Boardroom Tables: Leadership Conference Table,0,https://pictures-kenya.jijistatic.com/72637798_MzAwLTMwMC0wOTRiZTJhODQw.webp,03/05/2025 22:49,38500,16,"Nairobi, Unknown","A Leadership Conference Table is a high-end, sophisticated table designed for executive meetings,...",Brand New,1,03/05/2025 22:49,1
FALSE,FALSE,Camera,Microphone Holder for Churches,250,https://pictures-kenya.jijistatic.com/74080330_MzAwLTUzMy1jYTQ0NzBkMmZh.webp,03/05/2025 22:49,7500,6,"Nairobi, Unknown","We customize all our podiums as per the needs of our clients in terms of designs , color and size",Brand New,2,03/05/2025 22:49,0
FALSE,TRUE,Camera,Microphone Stand for Churches,0,https://pictures-kenya.jijistatic.com/68344479_MzAwLTM5OS1kZjg1NTY0ZTM1.webp,03/05/2025 22:49,3000,22,"Nairobi, Unknown","We customise mic holders , offering boxes and Podiums",Brand New,4,03/05/2025 22:49,1
FALSE,TRUE,Camera,Customised Church Mic Holder Stand,0,https://pictures-kenya.jijistatic.com/67807021_MzAwLTY2Ny03OTdlYTExMzNm.webp,03/05/2025 22:49,3500,12,"Nairobi, Unknown",We customise as per your preference.Holds both wired and wireless microphones,Brand New,4,03/05/2025 22:49,1
FALSE,FALSE,Camera,Church Microphone Holder,126,https://pictures-kenya.jijistatic.com/67445134_MzAwLTY2Ny00NDdjYmI5ZDIw.webp,03/05/2025 22:49,3800,3,"Nairobi, Unknown",We customise as per the needs of the client,Brand New,1,03/05/2025 22:49,0
FALSE,TRUE,Camera,Church Microphone Holder Customised Stand,0,https://pictures-kenya.jijistatic.com/67807004_MzAwLTY2Ny0yYTI0MGRkNzVi.webp,03/05/2025 22:49,3800,12,"Nairobi, Unknown",We customise as per your preference.Holds both wired and wireless microphones,Brand New,5,03/05/2025 22:49,1
